{
  "schema": "frame-state-v1",
  "target_sha256": "6eb45c09faa838df679534ee77f12786f48e51a6f6d26a31ce73e8af72d410d9",
  "revision": 1,
  "previous_state_sha256": "8aafc1b5ce935c3cae3e7711ffb790854db9f5e194f81da713fbc5a1b89f56ea",
  "root_claim_id": "EXAMPLE-1",
  "claims": {
    "EXAMPLE-1": {
      "claim_id": "EXAMPLE-1",
      "statement": "the candidate artifact normalizes to the expected value",
      "status": "CHECKED_BOUNDED",
      "dependency_mode": "LEAF",
      "dependencies": [],
      "evidence_refs": [
        "f038d7fe645d21461c15ec8f178183f9c68d882ba9b75cf3ce0abd72dc8f5873"
      ],
      "ceiling": "VERIFIED",
      "admitted_by": "ADM-6eb45c09"
    }
  },
  "active_obstruction": null,
  "open_gaps": [],
  "outcome": "PARTIAL",
  "history": [
    {
      "revision": 1,
      "admission_id": "ADM-6eb45c09",
      "decision": "ACCEPT",
      "granted_status": "CHECKED_BOUNDED",
      "claim_ids": [
        "EXAMPLE-1"
      ],
      "admission_sha256": "8ffc1d0fbe4059bd9dcf21b8b50a04260dfdb96de85b4e92a87b53a688a43ced"
    }
  ]
}
